{"act_device_name":null,"base_system_id":"n0-twam","base_system_manifest_sha256":null,"checkpoint_sha256":"0000000000000000000000000000000000000000000000000000000000000000","condition":"clean","config_sha256":"0000000000000000000000000000000000000000000000000000000000000000","dataset_sha256":"0000000000000000000000000000000000000000000000000000000000000000","execute_action_steps":24,"exogenous_seed":20,"fault_manifest_path":null,"initial_seed":10,"launcher_args":{"enable_cameras":true,"headless":true,"kit_args":"--/app/hangDetector/enabled=false"},"matched_no_touch_artifact_path":null,"matched_no_touch_system_id":null,"max_control_cycles":300,"max_observation_steps":301,"n0_normalizer_sha256":"0000000000000000000000000000000000000000000000000000000000000000","n0_prompt_manifest_sha256":"0000000000000000000000000000000000000000000000000000000000000000","n0_serve_bundle_sha256":"0000000000000000000000000000000000000000000000000000000000000000","n0_source_commit":"c43a2160dd31c449d92b28eab52c0e2f09e4738a","output_dir":"../../deployment/artifacts/live-univtac/examples/n0-clean","policy_kind":"n0","rest_references_path":null,"runtime_dir":"../../deployment/runtime/live-univtac/n0/pull_out_key","semantic_version":"2.0","simulator_device":"cuda:0","task_id":"pull_out_key","upstream_root":"../../deployment/sources/UniVTAC","wall_timeout_s":900.0}
